id,categoria,precio,precio_mxn,precio_usd,fecha_conversion,propiedad,metros_total,metros_construido,precio_m2_terreno,precio_m2_construido,tiempo_de_publicacion,meses_transcurridos,meses_transcurridos_fecha,tipo,Status,estacionamientos,recamaras,banos,medio_banos,bano_total,seguridad_privada,tipo_lugar,Colonia,Municipio,Estado,Colonia_Estandarizada,codigo_postal,ubicacion,url,descripcion
38,D1,1180000,1180000,59142,2024-11-05,"CASA EN FRACCIONAMIENTO CERRADO, CIMA DORADA TULANCINGO",105,77,11238.09523809524,15324.675324675323,2023-12-15,4,2024-04-30,Casa,Venta,0,2,1,0,1.0,No,,san jose caltengo,tulancingo de bravo,hidalgo,san jose caltengo,43628.0,"San José Caltengo, Tulancingo de Bravo, Hidalgo",https://www.lamudi.com.mx//detalle/41032-73-60f9fc9ca4df-8fdf-6c7094aa-a826-4471,"El fraccionamiento Cima Dorada cuenta con 2 acceso con caseta de vigilancia, pista para caminatas, área de asadores, cancha de basquetbol y área de juegos para niños.Ubicado a tan solo 5 minutos del centro de la cuidad, a un costado de la zona Arqueológica de Huapalcalco, muy cerca de clínicas médicas, hospitales, escuelas, establecimientos comerciales, central de autobuses, transporte público a una cuadra. La casa cuenta con:Sala-comedor.Cocina con tarja.1 baño completo.2 recámaras amplias.Patio de servicio.Cochera para 1 vehículos.Jardín interior artificial con acceso por sala comedor.AMENIDADES:Cisterna de 3,300 litrosTanque estacionario.Calentador de gas. Tinaco de 1,100 litros.Bomba de agua. Luminarias LED. Pregunta por la forma de pago.*El precio publicado corresponde a la propiedad, NO incluye gastos de escrituración u otros conceptos. PRECIO SUJETO A CAMBIOS Y/O VARIACIONES SIN PREVIO AVISOHorario de atenciónLunes a viernes: 10:00 a 14:00 y 17:00 a 19:00Sábados: 10:00 a 14:00Domingos: previa cita""HAY UN LUGAR ESPERANDO SER TU HOGAR"""
39,D1,1157000,1157000,57989,2024-11-05,Casa en venta con 3 recámaras en  Tulancingo,72,81,16069.444444444443,14283.95061728395,2023-04-24,12,2024-04-30,Casa En Fraccionamiento,Venta,0,3,2,0,2.0,No,,villa sol,tulancingo de bravo,hidalgo,villa sol,43648.0,"Villa Sol, Tulancingo de Bravo, Hidalgo",https://www.lamudi.com.mx//detalle/41032-73-96ac604bba20-635d-4730664-89a4-3be2,"Vive la experiencia de vivir en uno de los lugares más emblemáticos del país en dónde la herencia cultural prehispánica y la tranquilidad de la vida cotidiana se fusionan.Casa con increíbles amenidades: Áreas verdes, jardín común con juegos infantiles, caseta de entrada y salida, trotapista y ciclopista, alumbardo público fotovoltaico, planta de tratamiento de aguas Residuales para reuso.Ubicada en la mejor zona de la ciudad, muy cerca de:Centro comercial Patio Tulancingo.Universidad Tecnológica deTulancingoSam’s Club WalmartCentral de abastosHospital General Tulancingo, BimboCoca Cola CFE"
40,D1,1150000,1150000,57638,2024-11-05,"CASA NUEVA EN PRIVADA SAN DANIEL, TULANCINGO HIDALGO",105,62,10952.380952380952,18548.3870967742,2023-04-20,12,2024-04-30,Casa,Venta,1,2,1,0,1.0,No,,conjunto habitacional los mesones,tulancingo de bravo,hidalgo,privada los mesones,43624.0,"Conjunto Habitacional Los Mesones, Tulancingo de Bravo, Hidalgo",https://www.lamudi.com.mx//detalle/41032-73-e1e9f2183ac5-7f02-5ba171a0-bd32-34c5,"CASA EN PRIVADA SAN DANIEL Casa ubicada en Privada San Daniel muy cerca de la Unidad Deportiva, excelente ubicación a 10 min del centro de Tulancingo y a 5 min de la central de abastos. La zona cuenta con escuelas públicas y privadas (de educación básica, media, media superior y superior), parques cerca, gasolineras, tiendas de auto servicio, etc...  La casa cuenta con:  2 recámaras. Sala. Comedor. Cocina. 1 baño. Área de lavado. Cochera para un vehículo. Cisterna. Construccion nueva.   Pregunta por la forma de pago. PRECIO SUJETO A CAMBIOS Y/O VARIACIONES SIN PREVIO AVISO *El precio publicado corresponde a la propiedad, NO incluye gastos de escrituración u otros conceptos.  Horario de atención Lunes a viernes: 10:00 a 14:00 y 17:00 a 19:00 Sábados: 10:00 a 14:00 Domingos: previa cita Mayores informes y citas: Ver teléfono Whatsapp // WhatsApp // WhatsApp // WhatsApp ""HAY UN LUGAR ESPERANDO SER TU HOGAR"""
41,D1,1100000,1100000,55132,2024-11-05,VENTA DE CASA 3 RECAMARAS EN TULANCINGO HIDALGO,105,102,10476.190476190475,10784.313725490196,2023-04-20,12,2024-04-30,Casa En Fraccionamiento,Venta,1,3,2,0,2.0,No,,tulancingo de bravo centro,tulancingo de bravo,hidalgo,tulancingo centro,43600.0,"Tulancingo de Bravo Centro, Tulancingo de Bravo, Hidalgo",https://www.lamudi.com.mx//detalle/41032-73-855a866a4c28-80e9-6b217a01-90e4-3abf,"VENTA DE CASA NUEVA Y AMPLIA EN TULANCINGO HIDALGO.  3 RECAMARAS, SALA, COMEDOR, COCINA, JARDÍN, ESTACIONAMIENTO AMPLIO, PATIO DE SERVICIO, 2 BAÑOS.  105 METROS DE TERRENO Y 102 METROS DE CONSTRUCCIÓN.  Cercania con la carretera federal México Tuxpan. Cerca de escuelas, transporte, servicio de telefonía cable e internet. A 10 min del centro de Tulancingo. A 5 minutos de la Plaza comercial Plaza Patio, donde encontrarás zona de bancos, Mega Soriana, Oficce Depot, Suburbia, cines, etc.  ACEPTO CRÉDITOS INFONAVIT FOVISSSTE BANCARIOS ISSFAM CFE BANJERCITO IMSS.  !!!Asesoría inmobiliaria y jurídica GRATIS!!!  Visita nuestra página web:"
42,D1,1100000,1100000,55132,2024-11-05,VENTA DE CASA ECONOMICA DE 4 RECAMARAS EN COLONIA EL PARAISO EN TULANCINGO HIDALGO,160,100,6875.0,11000.0,2023-04-29,12,2024-04-30,Casa,Venta,1,4,1,0,1.0,No,,tulancingo de bravo centro,tulancingo de bravo,hidalgo,tulancingo centro,43600.0,"Tulancingo de Bravo Centro, Tulancingo de Bravo, Hidalgo",https://www.lamudi.com.mx//detalle/41032-73-46863522d18d-457e-9ef05d1f-a468-3838,"Venta de casa económica de 4 recamaras en el paraíso.A tan solo 10 min del centro de TulancingoA 3 minutos del circuito ChapultepecTransporte público pasa frente a la casa.Cercania con escuelas, iglesia, mercado y Bodega Aurrera 160 metros de terreno100 metros de construcción aprox 4 recamaras 3 baños y medio Sala.Comedor.Cocina Estacionamiento para 3 autosPatio de servicio amplio 1 bodega Acepto créditos INFONAVIT FOVISSSTE ISSFAM IMSS BANCARIOS PAGOS DE CONTADO Contactar"
43,D1,1100000,1100000,55132,2024-11-05,HERMOSA CASA EN VENTA EN TULANCINGO DE BRAVO HIDALGO.,398,398,2763.819095477387,2763.819095477387,2024-02-28,2,2024-04-30,Casa,Venta,1,4,2,0,2.0,No,unidad habitacional,la morena,tulancingo de bravo,hidalgo,rinconada la morena,43625.0,"Unidad Habitacional La Morena, Tulancingo de Bravo, Hidalgo",https://www.lamudi.com.mx//detalle/41032-73-c3d586e6bb16-bbfd-7ff3c95e-a3d7-4960,"HERMOSA Y AMPLIA CASA EN HIDALGO, CUENTA CON TODOS LOS SERVICIOS, UBICADA EN UNA DE LAS MEJORES ZONAS, CON EXCELENTE PLUSVALIA, RODEADA DE COLEGIOS, HOSPITALES, CENTROS COMERCIALES, RESTAURANTES, PARQUES Y MAS.NO LO PIENSES MAS E INVIENTE EN TU PATRIMONIO CON UNA PROPIEDAD DE OPORTUNIDAD, MUY POR DEBAJO DE SU VALOR COMERCIAL."
44,D1,1080000,1080000,54130,2024-11-05,"Casa con opción de crecimiento en Villas Santa María, Tulancingo Hgo.",105,73,10285.714285714286,14794.520547945203,2023-12-15,4,2024-04-30,Casa,Venta,0,2,1,0,1.0,No,,ampliacion javier rojo gomez,tulancingo de bravo,hidalgo,ampliacion rojo gomez,43645.0,"Ampliación Javier Rojo Gómez, Tulancingo de Bravo, Hidalgo",https://www.lamudi.com.mx//detalle/41032-73-148a066ebd7c-a22f-24777fa3-acc5-46bd,"Fraccionamiento Villas Santa María ubicado en una zona con accesos a CDMX y Pachuca, muy cerca de la carretera México-Tuxpan. Ideal para familias que comienzan su patrimonio o que buscan un espacio más acogedor, con seguridad y tranquilidad. El Fraccionamiento cuenta con: barda perimetral, caseta de vigilancia, áreas verdes, juegos y aparatos de ejercicio al aire libre, calles de concreto, servicios ocultos, casas con muros independientes, cimientos de piedra, está proyectado para tener su propia area comercial y se cuenta con un reglamento interno para una sana convivencia.La zona cuenta con todos los servicios, establecimientos de primera necesidad a los alrededores, transporte público cercano, escuelas desde nivel básico hasta superior (Universidad Técnológica de Tulancingo), a solo 10 minutos del centro de Tulancingo, a 5 minutos de Plaza Patio. La casa cuenta con:2 recámaras con closet.1 alcoba.Sala-comedor.Cocina integral con barra desayunadora.1 baño forrado de azulejo.Cochera.Área de lavado.Cisterna con bomba de 2,500 litros.Tinaco de 1,100 litros.Con opción de crecimiento!!Pregunta por la forma de pago.PRECIO SUJETO A CAMBIOS Y/O VARIACIONES SIN PREVIO AVISO*El precio publicado corresponde a la propiedad, NO incluye gastos de escrituración u otros conceptos. Horario de atenciónLunes a viernes: 10:00 a 14:00 y 16:00 a 18:00Sábados: 10:00 a 14:00Domingos: previa citaMayores informes y citas: Ver teléfono Whatsapp // WhatsApp // WhatsApp // WhatsApp""HAY UN LUGAR ESPERANDO SER TU HOGAR"""
45,D1,1050000,1050000,52626,2024-11-05,"CASA DE 1 NIVEL EN PRIVADA, TULANCINGO HIDALGO",105,70,10000.0,15000.0,2024-03-02,1,2024-04-30,Casa,Venta,0,2,1,0,1.0,No,,ampliacion javier rojo gomez,tulancingo de bravo,hidalgo,ampliacion rojo gomez,43645.0,"Ampliación Javier Rojo Gómez, Tulancingo de Bravo, Hidalgo",https://www.lamudi.com.mx//detalle/41032-73-58b55adc017b-6914-f7d09bf-9a71-458e,"Villas Santa María es un nuevo fraccionamiento que tiene la ubicación exacta para personas que vienen de CDMX, Pachuca o aquellos que buscan salir rápido de la ciudad u ocupan viajar sobre la carretera México-Tuxpan continuamente. Ideal para familias pequeñas que comienzan su patrimonio o que buscan un espacio más acogedor, la seguridad y tranquilidad la tendrás en este, ¡tú nuevo hogar!.  Cuenta con todos los servicios, establecimientos de primera necesidad a los alrededores, farmacias, transporte público cercano, escuelas desde nivel básico hasta superior (Universidad Técnológica de Tulancingo), a solo 10 minutos del centro de Tulancingo. La casa cuenta con:Sala.Comedor.Cocina .1 baño.2 recámaras.Cochera para 1 auto.Área de lavado.Pregunta por la forma de pago.PRECIO SUJETO A CAMBIOS Y/O VARIACIONES SIN PREVIO AVISO*El precio publicado corresponde a la propiedad, NO incluye gastos de escrituración u otros conceptos. Horario de atenciónLunes a viernes: 10:00 a 14:00 y 17:00 a 19:00Sábados: 10:00 a 14:00Domingos: previa cita""HAY UN LUGAR ESPERANDO SER TU HOGAR"""
46,D1,1050000,1050000,52626,2024-11-05,VENTA DE CASA DE LUJO 3 RECAMARAS EN TULANCINGO,80,120,13125.0,8750.0,2023-07-02,9,2024-04-30,Casa,Venta,1,3,1,0,1.0,No,,medias tierras,tulancingo de bravo,hidalgo,medias tierras,43698.0,"Medias Tierras, Tulancingo de Bravo, Hidalgo",https://www.lamudi.com.mx//detalle/41032-73-89ca4ee22d25-18f8-67cdfbc9-994b-1237,"Casa ideal para personas que desean tranquilidad y cercanía al centro de Tulancingo.Cuenta con todos los servicios como agua, luz,drenaje, pavimento, servicio de internet y telefonía. Cercanía a escuelas de educación básica.A unos metros de la nueva Fiscalía.AURRERA, OXXO, farmacias, gasolineras, etc. Casa en privada con exclusivamente 4 viviendas col san IsidroCuenta con3 recámarasSalaCocina c/ cocinetaComedor1.5 bañosCisterna 5000ltsEstacionamiento 2 autosTerreno 80 m2Contruccion 120m2Precio $1,179,000"
47,D1,1031100,1031100,51679,2024-11-05,Oportunidad de compra en Tulancingo,110,110,9373.636363636364,9373.636363636364,2024-03-04,1,2024-04-30,Casa,Venta,1,3,2,0,2.0,No,,vicente guerrero 1ra seccion,tulancingo de bravo,hidalgo,vicente guerrero,43630.0,"Vicente Guerrero 1ra Sección, Tulancingo de Bravo, Hidalgo",https://www.lamudi.com.mx//detalle/41032-73-fa15f10ac271-f310-6ae34913-9618-42ac,"“CUMPLE TU SUEÑO CON NOSOTROS""Hermosa y amplia casa con excelentes acabados y todas las comodidades que soñaste, ahora a tu alcance.Cuenta con…*3 Habitaciones*2 Baños completos*1 Garaje*Cocina equipada *Área común -Asesoría 24/7 desde la primera llamada.Te asesoramos y acompañamos hasta concluir con la entrega de ""Tu nuevo hogar”Elizabeth DiazAsesor inmobiliarioPara mayor información contáctame o déjame tu número, a la brevedad me comunico."
48,E3,990100,990100,49624,2024-11-05,"Vivienda en venta con gran plusvalía de remate dentro de Calle Hermenegildo Galeana 706, Vicente Guerrero, Tulancingo, Estado de Hidalgo, México",110,110,9000.90909090909,9000.90909090909,2023-12-30,4,2024-04-30,Casa,Venta,1,3,2,0,2.0,No,,vicente guerrero 1ra seccion,tulancingo de bravo,hidalgo,vicente guerrero,43630.0,"Vicente Guerrero 1ra Sección, Tulancingo de Bravo, Hidalgo",https://www.lamudi.com.mx//detalle/41032-73-db570cd0d44e-1be3-5ab37df6-83f7-4656,"TENEMOS LA LLAVE DE TUS SUEÑOS¡¡OPORTUNIDAD DE INVERSIÓN!!No se acepta NINGÚN TIPO DE CRÉDITOExcelente ubicación de fácil acceso en zona de alta plusvalía y en aumento.GARANTIZO LA ENTREGA POR CONTRATO Y LA ESCRITURACIÓN ANTE NOTARIO PÚBLICO.Las mejores alternativas de inversión inmobiliaria las tenemos nosotros, somos una empresa especializada en recuperaciones hipotecarias.Nuestros inmuebles se encuentran entre un 40 y 70% menor de su valor comercial - Vías de comunicación y servicios cerca.¡¡Agenda tu cita vía telefónica o whats app!! para más información"
49,E3,990000,990000,49619,2024-11-05,EXTRENA TU CASA A BAJO COSTO EN **TULANCINGO DE BRAVO** HGO.,110,110,9000.0,9000.0,2024-02-09,2,2024-04-30,Casa,Venta,1,3,1,0,1.0,No,,vicente guerrero 1ra seccion,tulancingo de bravo,hidalgo,vicente guerrero,43630.0,"Vicente Guerrero 1ra Sección, Tulancingo de Bravo, Hidalgo",https://www.lamudi.com.mx//detalle/41032-73-bf57b977d082-55cb-a85d7cdf-ba19-4e54,"CUMPLE TU SUEÑO CON NOSOTROS"" Hermosa y amplia casa con excelentes acabados y todas las comodidades que soñaste, ahora a tu alcance. Cuenta con… 3 Habitaciones 2 Baños completos1 Garaje  -Asesoría 24/7 desde la primera llamada. Te asesoramos y acompañamos hasta concluir con la entrega de ""Tu nuevo hogar” Para mayor información contáctame o déjame tu número, a la brevedad me comunico"
50,E3,985000,985000,49368,2024-11-05,"CASA DE 1 NIVEL EN FRACC. VILLAS SANTA MARIA, TULANCINGO HIDALGO",105,76,9380.952380952382,12960.526315789471,2023-05-13,11,2024-04-30,Casa En Fraccionamiento,Venta,1,2,1,0,1.0,No,,ampliacion javier rojo gomez,tulancingo de bravo,hidalgo,ampliacion rojo gomez,43645.0,"Ampliación Javier Rojo Gómez, Tulancingo de Bravo, Hidalgo",https://www.lamudi.com.mx//detalle/41032-73-7ce59ea81ac0-ba8f-53ce538d-9349-3d2f,"CASA EN VENTA, VILLAS SANTA MARÍA.Villas Santa María es un nuevo fraccionamiento que tiene la ubicación exacta para personas que vienen de CDMX, Pachuca o aquellos que buscan salir rápido de la ciudad u ocupan viajar sobre la carretera México-Tuxpan continuamente. Ideal para familias pequeñas que comienzan su patrimonio o que buscan un espacio más acogedor, la seguridad y tranquilidad la tendrás en este, ¡tú nuevo hogar!Cuenta con todos los servicios, establecimientos de primera necesidad a los alrededores, farmacias, transporte público cercano, escuelas desde nivel básico hasta superior (Universidad Técnológica de Tulancingo), a solo 10 minutos del centro de Tulancingo.La casa cuenta con:  2 recámaras  Sala-comedor.  Cocina.  1 baño.  Cochera.  Área de lavado.AMENIDADES:  Fraccionamiento con barda perimetral  Caseta de vigilancia  Areas Verdes  Juegos y aparatos de ejercicio al aire libre  Calles de concreto  Servicios ocultos  Casas con muros independientes  Cimientos de piedra  Proyectado para tener su propia area comercial  Reglamento de Fraccionamiento para una sana convivenciaPregunta por la forma de pago.PRECIO SUJETO A CAMBIOS Y/O VARIACIONES SIN PREVIO AVISO*El precio publicado corresponde a la propiedad, NO incluye gastos de escrituración u otros conceptos.Horario de atenciónLunes a viernes: 10:00 a 14:00 y 16:00 a 18:00Sábados: 10:00 a 14:00Domingos: previa citaMayores informes y citas: Ver teléfono Whatsapp // WhatsApp // WhatsApp // WhatsApp""HAY UN LUGAR ESPERANDO SER TU HOGAR"""
51,E3,984000,984000,49318,2024-11-05,Casa en venta con 3 recámaras en Tulancingo,72,67,13666.666666666666,14686.567164179103,2023-04-24,12,2024-04-30,Casa En Fraccionamiento,Venta,0,3,2,0,2.0,No,,villa sol,tulancingo de bravo,hidalgo,villa sol,43648.0,"Villa Sol, Tulancingo de Bravo, Hidalgo",https://www.lamudi.com.mx//detalle/41032-73-a533d1c6b1d4-b82f-b4e9c29b-9bda-3798,"Vive la experiencia de vivir en uno de los lugares más emblemáticos del país en dónde la herencia cultural prehispánica y la tranquilidad de la vida cotidiana se fusionan.Casa con increíbles amenidades: Áreas verdes, jardín común con juegos infantiles, caseta de entrada y salida, trotapista y ciclopista, alumbardo público fotovoltaico, planta de tratamiento de aguas Residuales para reuso.Ubicada en la mejor zona de la ciudad, muy cerca de:Centro comercial Patio Tulancingo.Universidad Tecnológica deTulancingoSam’s Club WalmartCentral de abastosHospital General Tulancingo, BimboCoca Cola CFE"
52,E3,980000,980000,49118,2024-11-05,"Inmueble adjudicado en Tulancingo, Hidalgo",110,110,8909.09090909091,8909.09090909091,2024-01-03,3,2024-04-30,Casa,Venta,1,3,2,0,2.0,No,,vicente guerrero 1ra seccion,tulancingo de bravo,hidalgo,vicente guerrero,43630.0,"Vicente Guerrero 1ra Sección, Tulancingo de Bravo, Hidalgo",https://www.lamudi.com.mx//detalle/41032-73-c1f29b7f102f-3101-c4a42d6b-b2d3-4e63,"PRECIO REMATE:  $980,000.00 Hermosa CASA de tres pisos, en una de la zona más tranquilas de Tulancingo de Bravo, Hidalgo.  Gran plusvalía, cercanía con comercios en general y avenidas principales.*Oferta bancaria por créditos hipotecarios NO pagados.*Somos una empresa líder en Remates Bancarios en México.*Contamos con años de experiencia y casos reales de familias felices con su entrega.*Contamos con convenios y contratos con los principales Bancos para comercializar sus inmuebles.*Te acompañamos durante todo el proceso.*Inmuebles ADJUDICADOS.¡¡¡NO BUSQUES MAS!!! Contáctame para realizar una cita informativa, sin compromiso y veras lo fácil que es obtener una nueva casa para inversión o para uso propio."
53,E3,950000,950000,47614,2024-11-05,"¡Compra Gran Oportunidad! ¡Iluminada Casa Adjudicada!  ¡Cesión Inmediata Ante Notario, Recuperación Bancaria! CS/FJCO",140,140,6785.714285714285,6785.714285714285,2023-11-21,5,2024-04-30,Casa,Venta,1,3,1,0,1.0,No,fraccionamiento,el mirador,tulancingo de bravo,hidalgo,el mirador,43659.0,"Fraccionamiento El Mirador, Tulancingo de Bravo, Hidalgo",https://www.lamudi.com.mx//detalle/41032-73-b4c836456869-6b00-52d6e119-9cc6-4bc5,"Usted tiene la OPORTUNIDAD de adquirir este Inmueble POR DEBAJO de su valor comercial. ¡¡PROPIEDAD DE RECUPERACIÓN BANCARIA!!¡¡PROPIEDAD YA ADJUDICADA!!VALOR COMERCIAL: 2.7 MDP PRECIO REMATE: $ 950,000.00Amplia CASA en una de la zona más tranquila de PACHUCA y con gran PLUSVALÍA, céntrica a todos los servicios, escuelas, parques, mercados y plazas comerciales.-Oferta de recuperación bancaria por créditos hipotecarios NO pagados. -Contamos con convenios y contratos con los principales Bancos de México para comercializar sus Inmuebles. *Inmuebles ADJUDICADOS.*Inmuebles que ya recuperamos.¡¡¡CONTÁCTANOS!!! Y recibe más información, una explicación detallada de este inmueble y el proceso de compra.Contamos con una amplia cartera de Inmuebles en toda la CDMX, ESTADO DE MÉXICO, PUEBLA, QUERÉTARO, JALISCO, SAN LUIS POTOSÍ, MORELOS y el resto de la República. Somos Bróker directo de Bancos."
54,E3,950000,950000,47614,2024-11-05,VENTA DE CASA ECONÓMICA EN PRIVADA EN TULANCINGO 3 RECAMARAS,90,90,10555.555555555557,10555.555555555557,2023-04-21,12,2024-04-30,Casa En Fraccionamiento,Venta,1,3,2,0,2.0,No,,tulancingo de bravo centro,tulancingo de bravo,hidalgo,tulancingo centro,43600.0,"Tulancingo de Bravo Centro, Tulancingo de Bravo, Hidalgo",https://www.lamudi.com.mx//detalle/41032-73-726621aca3cf-3af-888d711b-a8a1-337b,"REMATO CASA EN FRACCIONAMIENTO RESIDENCIAL PRIVADO ""VISTA REAL""3 recamarasSala ComedorCocinaEstudioTerrazaPatio de servicio incluye proteccionesCercanía con carretera principalFrente al CONALEPA 10 minutos de Tulancingo y a 5 minutos de JaltepecKinder, primaria secundaria y preparatoria.Cuenta con todos los servicios, agua, luz, drenaje, banquetas, pavimento, vigilancia las 24 horas.A 30 minutos de centros turísticos como Huasca de Ocampo y San Miguel Regla. Acepto créditos FOVISSSTE, BANCARIO Y PAGO DE CONTADOASESORÍA INMOBILIARIA Y JURÍDICA GRATISEN INMOBILIARIA RIALSA  TENEMOS  TU HOGAR IDEALEnvía mensaje y te brindamos todas las opciones de vivienda disponibles.Correo:ContactarPágina web: Contactar"
55,E3,945000,945000,47364,2024-11-05,Casa en venta Tulancingo Hidalgo,72,66,13125.0,14318.181818181818,2023-04-24,12,2024-04-30,Casa En Fraccionamiento,Venta,1,2,1,0,1.0,No,fraccionamiento,valle verde,tulancingo de bravo,hidalgo,valle verde,43648.0,"Fraccionamiento Valle Verde, Tulancingo de Bravo, Hidalgo",https://www.lamudi.com.mx//detalle/41032-73-6756a15193a6-bc40-86d16cf5-862d-3197,"Vive la experiencia de vivir en uno de los lugares más emblemáticos del país en dónde la herencia cultural prehispánica y la tranquilidad de la vida cotidiana se fusionan.Casa con increíbles amenidades: Áreas verdes, jardín común con juegos infantiles, caseta de entrada y salida, trotapista y ciclopista, alumbardo público fotovoltaico, planta de tratamiento de aguas Residuales para reuso.Ubicada en la mejor zona de la ciudad, muy cerca de:Centro comercial Patio Tulancingo.Universidad Tecnológica deTulancingoSam’s Club WalmartCentral de abastosHospital General Tulancingo, BimboCoca Cola CFE"
56,E3,903000,903000,45259,2024-11-05,VICENTE GUERRERO CASA EN VENTA TULANCINGO HIDALGO.,100,95,9030.0,9505.263157894737,2023-12-26,4,2024-04-30,Casa,Venta,1,3,2,0,2.0,No,,vicente guerrero 1ra seccion,tulancingo de bravo,hidalgo,vicente guerrero,43630.0,"Vicente Guerrero 1ra Sección, Tulancingo de Bravo, Hidalgo",https://www.lamudi.com.mx//detalle/41032-73-f949bbd4f426-ae4b-d072548c-8fcc-32a4,"VICENTE GUERRERO CASA EN VENTA TULANCINGO HIDALGO. Desarrollada en dos niveles, esta casa cuenta con 100 m2 de superficie y 95 m2 de construcción. Cuenta además con sala, comedor, cocina, tres recámaras, un baño completo y un lugar de estacionamientoSolamente al contado, no vendemos remates, vendemos inmuebles, no pedimos anticipos, ni apartados, ni enganches.Los inmuebles están sujetos a cambio de precio, sin previo aviso. Todo el proceso ante notario público. EasyBroker ID: EB-FJ7246"
57,E3,900000,900000,45108,2024-11-05,ES HORA DE REALIZAR TU SUEÑO Y ADQUIRIR ESTA HERMOSA CASA EN TULANCINGO HIDALGO,220,220,4090.909090909091,4090.909090909091,2024-03-04,1,2024-04-30,Casa,Venta,1,3,1,0,1.0,No,unidad habitacional,la morena,tulancingo de bravo,hidalgo,rinconada la morena,43625.0,"Unidad Habitacional La Morena, Tulancingo de Bravo, Hidalgo",https://www.lamudi.com.mx//detalle/41032-73-676e3c4dd0a1-ffc7-52ac93e1-97fa-4e8d,"¡EXCELENTE OPORTUNIDAD PARA ADQUIRIR ESTA PROPIEDAD!!!Puede ser utilizada para habitar, rentar, remodelación o reventa; se encuentra en una de las mejores zonas. - El inmueble se puede ver únicamente por la parte externa. ¿TE INTERESA ESTE INMUEBLE? CONTACTAME PUEDO BRINDARTE LA INFORMACION QUE NECESITES. ***ADQUIRIR TU CASA A TRAVÉS DE NOSOTROS ES LA MEJOR IDEA, POR ELLO TE INVITAMOS A QUE NOS CONOZCAS, LLAMA AGENDA UNA CITA Y BUSCAMOS LA OPCIÓN QUE MEJOR SE AJUSTE A TUS POSIBILIDADES***                 ¡NO DEJES PERDER ESTA GRAN OPORTUNIDAD!"
58,E3,895000,895000,44858,2024-11-05,"Casa en Venta Col. Lomas del Progreso, Tulancingo, Hidalgo",129,260,6937.984496124031,3442.3076923076924,2023-12-04,4,2024-04-30,Casa,Venta,1,3,3,0,3.0,No,,lomas de progreso,tulancingo de bravo,hidalgo,lomas de progreso,43615.0,"Lomas de Progreso, Tulancingo de Bravo, Hidalgo",https://www.lamudi.com.mx//detalle/41032-73-1317b748069a-fb8e-bd5e2fcc-a682-4496,"Casa en Venta Col. Lomas del Progreso, Tulancingo, Hidalgo¡¡INMEJORABLE OPORTUNIDAD! ¡RECUPERACIÓN BANCARIA !!!!Ubicación: OBSIDIANA, LOMAS DEL PROGRESO, TULANCINGO, HIDALGO¡¡INMUEBLE EN REMATE CON GRAN PLUSVALIA!AMPLIA, EN ZONA CÉNTRICA , OXXOS, FARMACIAS, TIENDAS HOSPITALES EN VIAS ALTERNAS RESTAURANTES CERCANOS DATE LA OPORTUNIDAD DE INVIERTIR EN TU PATRIMONIO.Acerca de Nosotros- Somos una empresa líder en Remates Bancarios en México.- Contamos con convenios y contratos con los principales Bancos para vender sus inmuebles.- Tenemos la mejor opción para ti.- Solo pagos de contado en dos exhibiciones.*No se acepta ningún tipo de crédito.SOMOS GRUPO ANTHAMSomos una empresa legalmente establecida dedicada a la intermediación inmobiliaria, comercización de inmuebles, venta de cesiones de derechos con garantía hipotecaria, entre otros.NUESTRA MISIÓNProteger el patrimonio de nuestros clientes, ayudando a cumplir sus metas y sueños de adquirir un inmueble en la zona que siempre desearon a un excelente precio.NUESTRA VISIÓNColocarnos entre las mejores empresas inmobiliarias a nivel nacional otorgando garantías claras y bajo contrato, para así mismo ser y seguir siendo la mejor opción para nuestros actuales y futuros cliente.Preguntas para la inmobiliaria"
