id,categoria,precio,precio_mxn,precio_usd,fecha_conversion,propiedad,metros_total,metros_construido,precio_m2_terreno,precio_m2_construido,tiempo_de_publicacion,meses_transcurridos,meses_transcurridos_fecha,tipo,Status,estacionamientos,recamaras,banos,medio_banos,bano_total,seguridad_privada,tipo_lugar,Colonia,Municipio,Estado,Colonia_Estandarizada,codigo_postal,ubicacion,url,descripcion
83,E2,600000,600000,30072,2024-11-05,"Casa en Rinconada la Morena, Tulancingo.",168,225,3571.428571428572,2666.6666666666665,2024-02-01,2,2024-04-30,Casa,Venta,1,3,2,0,2.0,No,fraccionamiento,rinconada la morena,tulancingo de bravo,hidalgo,rinconada la morena,43625.0,"Fraccionamiento Rinconada La Morena, Tulancingo de Bravo, Hidalgo",https://www.lamudi.com.mx//detalle/41032-73-d3f0d839cbb4-6a95-daf40633-8d10-44d0,"Citas e informes: Tel Whatsapp Esteban Hernandez. 55,38002825- Grupo líder en el medio de garantías hipotecarias.- No es posible uso de créditos.- Entrega garantizada, nuestra experiencia nos respalda.Tu nuevo comienzo empieza hoy, Grupo de Inversiones México."
84,E2,600000,600000,30072,2024-11-05,CASA EN VENTA GUADALUPE TULANCINGO HIDALGO MJH,240,185,2500.0,3243.243243243244,2023-11-27,5,2024-04-30,Casa,Venta,1,3,2,0,2.0,No,,rancho guadalupe,tulancingo de bravo,hidalgo,rancho guadalupe,43633.0,"Rancho Guadalupe, Tulancingo de Bravo, Hidalgo",https://www.lamudi.com.mx//detalle/41032-73-69c22f98a785-dd34-c7678403-9029-45a0,"Citas e informes: María José HernándezCel 55,39513946	¡Única oportunidad de tener tu casa!Hermosa casa en zona de excelente plusvalía, cerca de escuelas, hospitales, centros comerciales y fácil acceso a principales vías de comunicación. ¡Excelente costo, ubicación y distribución!Citas e informes: María José HernándezCel 55,39513946	•  No es posible el uso de créditos. •  Firma de contrato ante notario públicoEmpresa líder en administrar, recuperar y comercializar cartera vencida de las principales instituciones bancarias.Citas e informes: María José HernándezCel 55,39513946"
85,E2,600000,600000,30072,2024-11-05,"CASA EN VENTA - COL. LA MORENA, TULANCINGO",180,210,3333.333333333333,2857.1428571428573,2023-10-02,6,2024-04-30,Casa,Venta,0,3,2,0,2.0,No,unidad habitacional,la morena,tulancingo de bravo,hidalgo,rinconada la morena,43625.0,"Unidad Habitacional La Morena, Tulancingo de Bravo, Hidalgo",https://www.lamudi.com.mx//detalle/41032-73-ec594c4bb147-7627-6e552390-86f7-4e50,"¡ÚNICA OPORTUNIDAD DE TENER TU CASA!CASA EN VENTA - COL. LA MORENA, TULANCINGOHERMOSA CASA EN ZONA  CON EXCELENTE PLUSVALÍA, CERCA DE ESCUELAS, CLINICAS, HOSPITALES, CENTROS COMERCIALES Y BANCOS.FACIL ACCESO A PRINCIPALES VÍAS DE COMUNICACIÓN¡EXCELENTE COSTO, UBICACIÓN Y DISTRIBUCIÓN!INFORMES:LIC. JAVIER LOZANOWHATSAPP Ver teléfono WhatsappTORRE POLANCOGARANTÍAS- CONTRATOS NOTARIADOS- FACTURACION DE PAGOS- OFICINAS FISICAS NO VIRTUALES- PRECIOS POR DEBAJO DEL VALOR COMERCIAL- GRUPO LIDER EN EL MEDIO DE GARANTÍAS HIPOTECARIAS- NO ES POSIBLE EL USO DE CRÉDITOS, SOLO DE CONTADO CON RECURSOS PROPIOS- ENTREGA GARANTIZADA, NUESTRA EXPERIENCIA NOS RESPALDACITAS:LIC. JAVIER LOZANOWHATSAPP WhatsAppTORRE POLANCONO SE ACEPTAN CRÉDITOS ÚNICAMENTE RECURSOS PROPIOS."
86,E2,590000,590000,29571,2024-11-05,VENTA DE CASA ECONOMICA AMPLIA EN TULANCINGO 2 RECAMARAS,90,50,6555.555555555556,11800.0,2023-08-17,8,2024-04-30,Casa,Venta,1,2,1,0,1.0,No,,napateco,tulancingo de bravo,hidalgo,napateco,43629.0,"Napateco, Tulancingo de Bravo, Hidalgo",https://www.lamudi.com.mx//detalle/41032-73-5bf156c15edf-3d02-80444c89-8277-1237,"Venta de casa en HACIENDAS DE NAPATECOPRECIO 590 MIL 2 RECAMARASSALACOMEDORCOCINA JARDIN ESTACIONAMIENTOPATIO DE SERVICIOTerreno: 90 metros cuadradosConstrucción: 50 metros cuadrados Cercanía con escuelas, centros deportivos, OXXO, tiendas 3 B. Cuenta con todos los servicios, agua, luz, drenaje pavimento telefonía internet.A 10 minutos de la Universidad PolitécnicaA tan solo 15 minutos de TulancingoA 10 minutos de la terminal de autobuses. ACEPTO CRÉDITOS INFONAVIT FOVISSSTE ISSFAM IMSS BANCARIOS PAGOS DE CONTADOAsesoria inmobiliaria y jurídica GRATISCel.Ver teléfono WhatsappContactar"
87,E2,590000,590000,29571,2024-11-05,"ENCONTRASTE TU CASA IDEAL EN TULANCINGO, HIDALGO",266,398,2218.0451127819547,1482.4120603015076,2024-03-04,1,2024-04-30,Casa,Venta,1,3,1,0,1.0,No,unidad habitacional,la morena,tulancingo de bravo,hidalgo,rinconada la morena,43625.0,"Unidad Habitacional La Morena, Tulancingo de Bravo, Hidalgo",https://www.lamudi.com.mx//detalle/41032-73-2113a4bc2ba2-70c7-e2060305-8d7f-4ee4,"Lic. Alexa Venegas Ver teléfono WhatsappCasa en buen estado que cuenta con:- 3 habitaciones- 2 baños y medio- 2 cajon de estacionamiento- Excelente ubicaciónDescuento del 50% hasta el 70% de su valor comercial. Inversión 100% garantizada o la devolución de tu inversión. Entrega segura bajo contrato.!!!! Primer pago solo recursos propios, nada de créditos.Contáctame y Agenda tu cita sin compromisoLic. Alexa Venegas, asesora inmobiliaria. WhatsApp"
88,E2,589658,589658,29554,2024-11-05,CASA EN NAPATECO TULANCINGO DE BRAVO HIDALGO RECUPERACIÓN HIPOTECARIA,90,60,6551.755555555556,9827.633333333331,2024-03-04,1,2024-04-30,Casa,Venta,1,2,1,0,1.0,No,unidad habitacional,napateco,tulancingo de bravo,hidalgo,napateco,43629.0,"Unidad Habitacional Napateco, Tulancingo de Bravo, Hidalgo",https://www.lamudi.com.mx//detalle/41032-73-2b3a900c01cd-e0f1-939a8188-bf77-451f,"*NO SE ACEPTAN NINGÚN TIPO DE CRÉDITO.*REMATE BANCARIO.*ESTOS SE ADQUIEREN CON RECURSOS PROPIOS.¡¡¡¡ QUE NO TE GANEN EXCELENTE OPORTUNIDAD!!!!¡¡EMPIEZA A INCREMENTAR TU PATRIMONIO INVIRTIENDO EN PROPIEDADES POR MUY DEBAJO DE SU COSTO REAL, FIRMA DE CESIÓN DE DERECHOS ANTE NOTARIO PÚBLICO!! ¡¡LO MÁS IMPORTANTE QUE TU ENTREGA ES TOTALMENTE GARANTIZADA!!  CERCA DE ESCUELAS, PARQUES, TIENDAS DEPARTAMENTALES, HOSPITALES, RESTAURANTES, PRINCIPALES VÍAS DE ACCESOS, TODOS LOS SERVICIOS.  LOS PRECIOS PUEDEN CAMBIAR SIN PREVIO AVISO. EMPRESA LEGALMENTE CONSTITUIDA Y AL CORRIENTE DE SU SITUACIÓN FISCAL INCORPORADO AL SAT, SI USTED LO DESEA PODEMOS FACTURAR NUESTROS SERVICIOS. *PAGO DE CONTADO EN 2 EXHIBICIONES.*CESIÓN DE DERECHOS ANTE NOTARIO.*CONTAMOS CON ASESORÍA JURÍDICA CON AMPLIA EXPERIENCIA.*TRABAJAMOS DE LA MANO CON INSTITUCIONES BANCARIAS.*NUESTROS ABOGADOS LLEVAN TODO EL PROCESO HASTA LA ENTREGA DE LAS LLAVES.****TENEMOS PROPIEDADES EN LA MAYOR PARTE DE LA REPÚBLICA****¡¡GRAN OPORTUNIDAD DE INVERSIÓN!!AGENDA TU CITA EN NUESTRO CORPORATIVO, ASESORÍA GRATUITA.TE ATIENDE TU ASESORA JANET ARELLANO"
89,E2,580000,580000,29070,2024-11-05,"Casa en venta en Rinconada La Morena, Tulancingo Hidalgo. VPV",160,280,3625.0,2071.428571428572,2024-02-01,2,2024-04-30,Casa,Venta,0,4,1,0,1.0,No,unidad habitacional,la morena,tulancingo de bravo,hidalgo,rinconada la morena,43625.0,"Unidad Habitacional La Morena, Tulancingo de Bravo, Hidalgo",https://www.lamudi.com.mx//detalle/41032-73-823dbe357fb8-2f45-5ab98864-b5b7-4a16,"Es momento de hacer crecer tu patrimonio, y si el tiempo de entrega no es problema para ti, invierte en una propiedad de recuperación bancaria de forma fácil y sencilla.Te asesoramos y acompañamos durante todo el proceso, hasta la entrega de la propiedad.Vanessa Pérez ValenzuelaVer teléfono WhatsappCasa con una excelente ubicación, cerca de bancos, hospitales, escuelas y vías rápidas de comunicación.- Compra con recursos propios.- Entrega de 10 a 12 meses- Solo se puede ver por fuera, zona con alta plusvalíaContáctame y agenda una cita para darte todos los beneficios de esta compraVanessa Pérez ValenzuelaWhatsAppTu hogar, tu mejor inversión."
90,E2,580000,580000,29070,2024-11-05,"Propiedad en venta en Vicente Guerrero,Hidalgo",110,110,5272.727272727273,5272.727272727273,2024-03-04,1,2024-04-30,Casa,Venta,1,3,1,0,1.0,No,,vicente guerrero 1ra seccion,tulancingo de bravo,hidalgo,vicente guerrero,43630.0,"Vicente Guerrero 1ra Sección, Tulancingo de Bravo, Hidalgo",https://www.lamudi.com.mx//detalle/41032-73-d399a434de05-8122-30e5a070-8076-4fa1,"•CERTEZA Y CONFIANZA.•SEGURIDAD GARANTIZADA•AHORRA HASTA UN 70%.•OPERACIÓN CÓMODA EN 2 PAGOS.•NO ACEPTAMOS CRÉDITOS HIPOTECARIOS (INFONAVIT, FOVISSSTE, ETC).•SOLO RECURSOS PROPIOS•ESCRITURAMOS ANTE NOTARIO•PAGO DIRECTAMENTE CON LA INSTITUCIÓN FINANCIERA"
91,E2,580000,580000,29070,2024-11-05,PRECIOSA CASA EN TULANCINGO HIDALGO OAHM,150,280,3866.6666666666665,2071.428571428572,2023-11-23,5,2024-04-30,Casa,Venta,1,4,1,0,1.0,No,fraccionamiento,rinconada la morena,tulancingo de bravo,hidalgo,rinconada la morena,43625.0,"Fraccionamiento Rinconada La Morena, Tulancingo de Bravo, Hidalgo",https://www.lamudi.com.mx//detalle/41032-73-31c0d0c8c869-3288-13762b7d-982b-4ede,¡¡¡APROVECHA ESTA GRAN OPORTUNIDAD DE INVERSIÓN!!!PROPIEDAD EN RECUPERACIÓN BANCARIA.Protección legal durante todo el proceso.Firma de cesión de derechos ante notario público.Pago en dos exhibiciones.Garantía de entrega del inmueble por escrito.Solo pago de contado.Asesoría gratuita en nuestro Corporativo.Solicita información y agenda tu cita al Ver teléfono Whatsapp
92,E2,578000,578000,28970,2024-11-05,"BONITA CASA EN VENTA EN LA MORENA, TULANCINGO",178,178,3247.191011235955,3247.191011235955,2024-01-29,3,2024-04-30,Casa,Venta,1,3,2,0,2.0,No,unidad habitacional,la morena,tulancingo de bravo,hidalgo,rinconada la morena,43625.0,"Unidad Habitacional La Morena, Tulancingo de Bravo, Hidalgo",https://www.lamudi.com.mx//detalle/41032-73-fbb2e5ddca9e-6caa-3dbace8f-9f6e-46b4,"UNICA OPORTUNIDAD PARA COMPRAR SU CASA POR RECUPERACION BANCARIA, ADQUIERE SU CASA A UN BAJO PRECIO. ESTE TIPO DE ADQUISICION TIENE ESTAS CARACTERISTICAS: NO SE ACEPTAN CREDITOS INFONAVIT O FOVISSTE, SOLO SE AEPTAN RECURSOS PROPIOS. LA PROPIEDAD NO SE PUEDE VER EN EL INTERIOR. LA ENTREGA ES DE 8 A 10 MESES.BONITA CASA EN VENTA EN HIDALGO, EL INMUEBLE CUENTA CON SALA, COMEDOR, COCINA, 3 RECAMARAS AMPLIAS, 2 BAÑOS, LUGAR DE ESTACIONAMIENTO PRIVADO. EXCELENTE UBICACIÓN CERCA DE: UNIVERSIDADES, ESCUELAS, HOSPITALES, CLINICAS, CAFETERIAS Y TIENDAS DE AUTO SERVICIO."
93,E2,578000,578000,28970,2024-11-05,SE VENDE CASA EN TULANCINGO DE BRAVO,230,178,2513.043478260869,3247.191011235955,2024-03-05,1,2024-04-30,Casa,Venta,1,3,2,0,2.0,No,unidad habitacional,la morena,tulancingo de bravo,hidalgo,rinconada la morena,43625.0,"Unidad Habitacional La Morena, Tulancingo de Bravo, Hidalgo",https://www.lamudi.com.mx//detalle/41032-73-68c6c2f82941-192d-99fcc3dc-bcc4-482c,"EXCELENTE OPORTUNIDAD DE ADQUIRIR LA CASA DE TUS SUEÑOS, LA CASA DE TUS SUEÑOS ESPERA POR TI.APROVECHA AHORA DONDE TENDRAS UNA VIDA COMODA Y TRANQUILA ¿CUAL ES? TE LA PRECENTO!! OJO LEE CON ATENCION!!QUE ESTE PUEDE SER LA CASA APROPIADA PARA TI Y TODA TU FAMILIA.SE UBICA EN UNA ZONA EXCELENTE, YA QUE ES TRANQUILA Y SEGURA.CUENTA CON EXCELENTE COBERTURA DONDE NO TENDRAS PROBLEMAS CON TU INTERNET O TELEFONIA .TAMBIEN PODRAS GOZAR DE COLOCAR TU SALA Y COMEDOR YA QUE CUENTA CON ESPACIOS AMPLIOSINCLUYE: (LAVADERO, AREA DE LAVADO, COCINA INTEGRAL, CISTERNA,).TENDRAS LUGARES CERCANOS COMO:( CENTROS COMERCIALES, RESTAURANTES, CENTRO DEPORTIVO, GIMNASIOS, HOTELES, CERCANIA CON PARQUES Y HOSPITALES, FACILADAD DE TRANSPORTE PUBLICO, ETC.)NO LO PIENSES MÁS!!ADQUIERE TU PROPIEDAD CON UN DESCUENTO DEL 50 AL 70% DE SU VALOR"
94,E2,570000,570000,28569,2024-11-05,"HERMOSA Y AMPLIA CASA EN JARDINES DEL SUR TULANCINGO HIDALGO, SUPER PRECIO!!!",225,360,2533.333333333333,1583.3333333333333,2024-02-02,2,2024-04-30,Casa,Venta,1,4,3,0,3.0,No,fraccionamiento,jardines del sur,tulancingo de bravo,hidalgo,jardines del sur,43660.0,"Fraccionamiento Jardines del Sur, Tulancingo de Bravo, Hidalgo",https://www.lamudi.com.mx//detalle/41032-73-9a87f2e30aa8-b101-a994006c-990c-4cc8,"¡¡¡QUE NO TE GANEN EXCELENTE OPORTUNIDAD DE INCREMENTAR TU PATRIMONIO!!! Ricardo LaraMóvil & WhatsApp: Ver teléfono WhatsappINCREMENTA TU PATRIMONIO CON TAN SOLO $290,000 Y EL SEGUNDO PAGO HASTA LA FIRMA DE CESION DE DERECHOS ANTE NOTARIO PUBLICO, TRAMITE AVALADO BAJO CONTRATO, ENTREGA GARANTIZADA!!! NO SE ACEPTA NINGUN CRÉDITO, SOLO RECURSO PROPIO. DOS PAGOS PARCIALES.Agenda tu cita en nuestro corporativo, ASESORIA GRATUITA.Con gusto te atenderá tu asesor: Ricardo Lara"
95,E2,560000,560000,28067,2024-11-05,"VENTA DE CASA EN LA MORENA SECC. NORTE, TULANCINGO, HGO.",120,180,4666.666666666667,3111.111111111112,2024-02-27,2,2024-04-30,Casa,Venta,1,3,1,0,1.0,No,unidad habitacional,la morena,tulancingo de bravo,hidalgo,rinconada la morena,43625.0,"Unidad Habitacional La Morena, Tulancingo de Bravo, Hidalgo",https://www.lamudi.com.mx//detalle/41032-73-97b436767fac-98aa-784cc262-919d-5012,"UNICA OPORTUNIDAD DE INVERSIÓN EN BIENES RAÍCES, PROPIEDAD A UN MUY BAJO COSTO Y CON EXCELENTE PLUSVALIA.  ADQUIERE ESTA PROPIEDAD CON UN DESCUENTO DEL 50 AL 70% DE SU VALOR COMERCIAL, SU INVERSION ESTA 100% SEGURA, ENTREGA GARANTIZADA!! ESPECIALISTAS EN RECUPERACIÓN DE INMUEBLES.               “””NO SE ACEPTAN CREDITOS"""""" CASA DE RECUPERACION BANCARIACONSTA DE:3 RECAMARASSALACOMEDOR2.5 BAÑOS2 ESTACIONAMIENTOSAREA DE SERVICIOMAYORES INFORMES CON MARIO VARGAS AL CEL Ver teléfono Whatsapp"
96,E2,560000,560000,28067,2024-11-05,CASA EN VENTA/PACHUCA,160,300,3500.0,1866.6666666666667,2023-11-21,5,2024-04-30,Casa,Venta,0,3,2,0,2.0,No,fraccionamiento,rinconada la morena,tulancingo de bravo,hidalgo,rinconada la morena,43625.0,"Fraccionamiento Rinconada La Morena, Tulancingo de Bravo, Hidalgo",https://www.lamudi.com.mx//detalle/41032-73-5d4420a4886c-7fbf-30efffe5-9871-4862,"HERMOSA PROPIEDAD CON OPORTUNIDAD DE CRECIMIENTO EN UNA DE LAS ZONAS CON MAS DESARROLLO ACTULMENTE CERCA DE HOSPITALES,ESCUELAS,CENTROS COMERCIALES,PARQUES Y TRANSPORTE PUBLICO ETC... CON HERMOSOS ACABADOS 2 PISOS,A PIE DE CALLE INMEJORABLE OPORTUNIDAD NO LA DEJES PASAR CON GUSTO TE ATIENDO Y TE EXPLICO COMO ADQUIRIRLA SIN COMPROMISO ALGUNO."
97,E2,560000,560000,28067,2024-11-05,"EXCELENTE CASA EN VENTA DE LAS FUENTES, LA MORENA TULANCINGO HIDALGO",120,180,4666.666666666667,3111.111111111112,2024-02-21,2,2024-04-30,Casa,Venta,1,3,1,0,1.0,No,unidad habitacional,la morena,tulancingo de bravo,hidalgo,rinconada la morena,43625.0,"Unidad Habitacional La Morena, Tulancingo de Bravo, Hidalgo",https://www.lamudi.com.mx//detalle/41032-73-f4ce5f5b66e1-be0e-651e4e35-a374-4e5a,"CASA CON BUENA UBICACION DENTRO DE LA COLONIA LA MORENA, CERCA DE AVENIDAS PRINCIPALES, ESCUELAS, BANCOS, HOSPITALES, SUPERMERCADOS, PARQUES. EL INMUEBLE CUENTA CON UNA COMODA ESTANCIA, COCINA INTEGRAL, SALA, COMEDOR, 3 AMPLIAS RECAMARAS, 2.5 BAÑOS, PEQUEÑO PATIO TRASERO Y 2 LUGARES DE ESTACIONAMIENTO.“NO SE ACEPTAN CREDITOS”CONTACTAME RMS"
98,E2,560000,560000,28067,2024-11-05,ES HORA DE REALIZAR TU SUEÑO Y ADQUIRIR ESTA HERMOSA CASA EN TULANCINGO HIDALGO,114,206,4912.2807017543855,2718.446601941748,2024-01-16,3,2024-04-30,Casa,Venta,1,3,1,0,1.0,No,unidad habitacional,la morena,tulancingo de bravo,hidalgo,rinconada la morena,43625.0,"Unidad Habitacional La Morena, Tulancingo de Bravo, Hidalgo",https://www.lamudi.com.mx//detalle/41032-73-f86cc0bfb87a-5642-7b90e0af-9609-458d,"¡EXCELENTE OPORTUNIDAD PARA ADQUIRIR ESTA PROPIEDAD!!!Puede ser utilizada para habitar, rentar, remodelación o reventa; se encuentra en una de las mejores zonas. - El inmueble se puede ver únicamente por la parte externa. ¿TE INTERESA ESTE INMUEBLE? CONTACTAME PUEDO BRINDARTE LA INFORMACION QUE NECESITES. ***ADQUIRIR TU CASA A TRAVÉS DE NOSOTROS ES LA MEJOR IDEA, POR ELLO TE INVITAMOS A QUE NOS CONOZCAS, LLAMA AGENDA UNA CITA Y BUSCAMOS LA OPCIÓN QUE MEJOR SE AJUSTE A TUS POSIBILIDADES***                 ¡NO DEJES PERDER ESTA GRAN OPORTUNIDAD!"
99,E2,550000,550000,27566,2024-11-05,"CASA EN VENTA VICENTE GUERRERO, TULANCINGO HIDALGO MJH",125,205,4400.0,2682.9268292682927,2023-11-27,5,2024-04-30,Casa,Venta,1,3,2,0,2.0,No,,vicente guerrero 1ra seccion,tulancingo de bravo,hidalgo,vicente guerrero,43630.0,"Vicente Guerrero 1ra Sección, Tulancingo de Bravo, Hidalgo",https://www.lamudi.com.mx//detalle/41032-73-f2a6b856db06-fa8c-631f5c75-a8f9-4af2,"Citas e informes: María José HernándezCel 55,39513946	¡Única oportunidad de tener tu casa!Hermosa casa en zona de excelente plusvalía, cerca de escuelas, hospitales, centros comerciales y fácil acceso a principales vías de comunicación. ¡Excelente costo, ubicación y distribución!Citas e informes: María José HernándezCel 55,39513946	•  No es posible el uso de créditos. •  Firma de contrato ante notario públicoEmpresa líder en administrar, recuperar y comercializar cartera vencida de las principales instituciones bancarias.Citas e informes: María José HernándezCel 55,39513946"
100,E2,549000,549000,27516,2024-11-05,KM CASA EN VENTA GUADALUPE TULANCINGO HIDALGO,105,100,5228.571428571428,5490.0,2024-02-15,2,2024-04-30,Casa,Venta,1,2,1,0,1.0,No,,rancho guadalupe,tulancingo de bravo,hidalgo,rancho guadalupe,43633.0,"Rancho Guadalupe, Tulancingo de Bravo, Hidalgo",https://www.lamudi.com.mx//detalle/41032-73-68a8b71f53a5-1476-4b5d6cab-919c-4d63,"¡REMATE BANCARIO! (NO CREDITOS, SOLO RECURSOS PROPIOS) Me da gusto que se ponga en contacto con nosotros y poderle brindar información sobre una increíble oportunidad de inversión en el mercado inmobiliario. ¿Alguna vez ha pensado en invertir en propiedades con un potencial de crecimiento excepcional?Hoy quiero platicarle de casas que están en proceso de recuperación por parte de los bancos. Estas propiedades no solo ofrecen una sólida inversión, sino también la posibilidad de convertirse en un hogar o negocio próspero.   - Estas casas tienen precios irresistibles debido a su estado actual, lo que le brinda la oportunidad de adquirir propiedades a un costo considerablemente más bajo que el valor de mercado.   - Tenemos una variedad de propiedades disponibles, desde casas familiares hasta apartamentos, lo que permite adaptarse a diferentes perfiles de inversores En resumen, estas casas en proceso de recuperación le brindan una oportunidad de inversión financiera y sólida.  Si están buscando una inversión inteligente y emocionante, ¡no busquen más!Me gustaría agendar una cita para platicar detalles específicos y brindarle más información sobre cómo puede aprovechar esta increíble oportunidadEstamos sujetos a precios y disponibilidad. KARINA LEMUS.Ver teléfono WhatsappID: AF13838OY.TMK"
101,E2,525000,525000,26313,2024-11-05,"CASAS SOLAS ECONOMICAS 2 RECAMARAS MAS ALCOBA, PARA INFONAVIT E ISSFAM",90,52,5833.333333333333,10096.153846153846,2023-04-28,12,2024-04-30,Casa,Venta,1,3,1,0,1.0,No,,huapalcalco,tulancingo de bravo,hidalgo,huapalcalco,43629.0,"Huapalcalco, Tulancingo de Bravo, Hidalgo",https://www.lamudi.com.mx//detalle/41032-73-d179f04ccd-a475-35c9e50f-a5a7-32a2,"Hermosas casas solas SOBRE AVENIDA PREA HACER NEGOCIO EN EL FUTURO, PASAN LAS COMBIS FRENTE A TU CASA APROVECHAel sueño de tener tu casa propia por fin una realidad aqui si te alcanza tener tu patrimonio para ti y tu familia2 recamaras mas alcobamuros independientesestacionamiento para 2 autoscasa de concreto solido alta resistenciapreparada pára crecer a 2 nivelesprecio $ 525,000 sin acabadosprecio $ 563,000 casa con acabadosCondición construcción: nuevaEstan en CUAUTEPEC DE HINOJOSA HIDALGO"
102,E2,525000,525000,26313,2024-11-05,Casas Solas 2 RECAMARAS MAS ALCOBA Infonavit E Issfam 90 M2 De Terreno,90,90,5833.333333333333,5833.333333333333,2023-04-24,12,2024-04-30,Casa,Venta,1,3,1,0,1.0,No,frac,c jardines del paraiso,tulancingo de bravo,hidalgo,jardines del paraiso,43684.0,"Fracc Jardines del Paraíso, Tulancingo de Bravo, Hidalgo",https://www.lamudi.com.mx//detalle/41032-73-eaa93dd772fd-d395-61a87f1f-9342-38ac,"CASAS SOBRE AVENIDA PRINCIPAL PASAN LAS COMBIS OPORTUNIDAD PARA NEGOCIO AL FUTURO APROVECHA TU CREDITO INFONAVIT Casa En Cuautepec Hidalgo A Solo 80 MINUTOS Hora Del Distrito Federal Compras Antes Del Mes De Mayo Te Regalamos El Calentador Solar Te Llevamos Gratis A Conocer El Desarrollo De La Cuida De Creditos Infonavit Nuestro Desarrollo Cumple Con Todos Los Beneficios Del Subsidio Federal La Opurtunidad De Tener Tu Casa En Una De Las Cuidades Mas Hermosas De La Republica Mexicana Balneario Los Molinos  Hermosa Casa En Cuautepec Hidalgo A Un Super Precio $ 525,000De Infonavit Entrega Inmediata  Precios $ 525,000 Aprovecha La Oportunidad Que Estabas Esperando  Características De La Casa:  *1 Nivel  *2 Recamaras Mas Alcoba  *90.00 M2 De Terreno  *55.00 M2 De Construccion  *Crecimiento Hasta 5 Recamaras  * Muros Independientes  * 2 Estacionamientos  * Jardin Trasero  * Patio De Servicio  * Piso De Cemento Pulido  * Azulejos En Areas Humedas  *Preciosa Fachada Modernista  *Gimnasio Al Aire Libre  *Zona De Multicanchas  *Areas De Juegos Para Niños  *Transporte A Unos Cuantos Pasos De Tu Casa  *Trato Directo Con La Empresa"
103,E2,520000,520000,26063,2024-11-05,CASA EN VENTA TULANCINGO HIDALGO,120,240,4333.333333333333,2166.6666666666665,2023-05-05,11,2024-04-30,Casa,Venta,1,4,2,0,2.0,No,,lomas de progreso,tulancingo de bravo,hidalgo,lomas de progreso,43615.0,"Lomas de Progreso, Tulancingo de Bravo, Hidalgo",https://www.lamudi.com.mx//detalle/41032-73-164b00fed1ad-5af1-9809fced-b47e-3231,"Hermosa casa muy bien ubicada en zona tranquila y de facil acceso. Está propiedad es de ""REMATE BANCARIO"", lo que te permite adquirirlas muy por debajo de su valor comercial.No se pueden ver por dentro hasta la entrega.SIN CREDITO ( infonavit,fovissste o bancario)ENTREGA EN 9 MESESSe acepta ÚNICAMENTE PAGO DE CONTADO, CESIÓN DE DERECHOS ANTE NOTARIO PÚBLICO.""TRAMITE BAJO CONTRATO""""Nos especializamos en remates bancarios, te asesoramos desde el inicio y hasta la entrega de tu propiedad"""
104,E2,500000,500000,25060,2024-11-05,"¡¡¡BONITA CASA EN TULANCINGO, HIDALGO!!! .SOC.",165,225,3030.3030303030305,2222.222222222222,2023-12-14,4,2024-04-30,Casa,Venta,1,4,1,0,1.0,No,unidad habitacional,la morena,tulancingo de bravo,hidalgo,rinconada la morena,43625.0,"Unidad Habitacional La Morena, Tulancingo de Bravo, Hidalgo",https://www.lamudi.com.mx//detalle/41032-73-d3c83135766a-5b1a-91985170-a46d-4208,"* ¡GRAN OPORTUNIDAD DE COMPRAR TU CASA! * ¡SÚPER PRECIO!¡¡¡BONITA CASA EN TULANCINGO, HIDALGO!!!* ¡GRAN OPORTUNIDAD DE INVERSIÓN! *BUENA UBICACIÓN CON ALTA PLUSVALÍA.CERCA DE LA CARRETERA TULANCINGO - HAUCHINANGO Y DE LA BODEGA AURRERA TULANCINGO.RODEADA DE PARQUES, CENTROS COMERCIALES Y RESTAURANTES.BLVD. LA MORENA COMO VÍA PRINCIPAL DE ACCESO.¡PAGO SOLO CON RECURSOS PROPIOS, EN 2 EXHIBICIONES! * NO CRÉDITOS *ASESORÍA GRATUITAINFORMACIÓN Y CITAS:TEL / WHATSAPP: Ver teléfono WhatsappLIC. STEPHANIE OROZCO."
105,E1,455000,455000,22805,2024-11-05,VENTA DE CASA EN TULANCINGO,100,180,4550.0,2527.777777777778,2024-03-04,1,2024-04-30,Casa,Venta,1,3,2,0,2.0,No,fraccionamiento,jardines del sur,tulancingo de bravo,hidalgo,jardines del sur,43660.0,"Fraccionamiento Jardines del Sur, Tulancingo de Bravo, Hidalgo",https://www.lamudi.com.mx//detalle/41032-73-ec6dc6be7b68-6fec-ab37b14c-8eb4-4fdb,"VENTA DE CASA EN EXCELENTE UBICACION CONECTADO A GRANDES AVENIDAS ESCUELAS, CENTROS COMERCIALES, SUPERMERCADOS, HOSPITALES LA CASA CUENTA CON SALA, COMEDOR, COCINA INTEGRAL, 3 RECAMARAS, 2 BAÑOS 1 LUGAR DE ESTACIONAMIENTO.  CASA DE RECUPERACION BANCARIA SOLO RECURSOS PROPIOS PAGO EN 2 EXCIVICIONESENTREGA BAJO CONTRATO 100% SEGURA"
106,E1,455000,455000,22805,2024-11-05,VENTA DE CASA EN TULANCINGO HIDALGO,115,200,3956.521739130435,2275.0,2024-03-04,1,2024-04-30,Casa,Venta,1,4,1,0,1.0,No,fraccionamiento,jardines del sur,tulancingo de bravo,hidalgo,jardines del sur,43660.0,"Fraccionamiento Jardines del Sur, Tulancingo de Bravo, Hidalgo",https://www.lamudi.com.mx//detalle/41032-73-f01bb06c8253-8033-fab37d7d-a8c0-4a56,"GRAN OPORTUNIDAD DE CASA CON EXCELENTE UBICACION CERCA DE AVENIDAS, PRINCIPALES, ESCUELAS, BANCOS, HOSPITALES, CENTROS COMERCIALES, CUENTA CON UNA COMODA ESTANCIA, COCINA INTEGRAL, CON 4 HABITACIONES, 3.5 BAÑOS, 2 LUGARES DE ESTACIONAMIENTOS."
107,E1,430000,430000,21552,2024-11-05,"PRECIOSA Y GRANDE CASA EN VENTA EN SAUSE 201, RINCONADA LA MORENA, TULANCINGO, HIDALGO",150,280,2866.6666666666665,1535.7142857142858,2024-02-26,2,2024-04-30,Casa,Venta,1,4,1,0,1.0,No,fraccionamiento,rinconada la morena,tulancingo de bravo,hidalgo,rinconada la morena,43625.0,"Fraccionamiento Rinconada La Morena, Tulancingo de Bravo, Hidalgo",https://www.lamudi.com.mx//detalle/41032-73-9e685b4056d8-9461-15fe34a2-8a82-4aec,"RECUPERACIÓN BANCARIA¡EXCELENTE OPORTUNIDAD! *RECUPERACION BANCARIA* PAGO DE CONTADO EN 2 EXHIBICIONES CON RECURSOS PROPIOS, SEGUNDO PAGO A LA FIRMA DE CESIÓN DE DERECHOS, ¡INVIERTE EN TU PATRIMONIO…ES TU OPORTUNIDAD!PRECIO POR DEBAJO DEL 50% DE VALOR COMERCIAL¡ENTREGA GARANTIZADA!ESPECIALISTAS EN RECUPERACIÓN DE INMUEBLES.FOTOGRAFÍAS DE REFERENCIAASESORÍA SIN COSTO EN NUESTRO CORPORATIVOINFORMES Y CITAS: VALERIA FLORES / Ver teléfono Whatsapp"
