id,categoria,precio,precio_mxn,precio_usd,fecha_conversion,propiedad,metros_total,metros_construido,precio_m2_terreno,precio_m2_construido,tiempo_de_publicacion,meses_transcurridos,meses_transcurridos_fecha,tipo,Status,estacionamientos,recamaras,banos,medio_banos,bano_total,seguridad_privada,tipo_lugar,Colonia,Municipio,Estado,Colonia_Estandarizada,codigo_postal,ubicacion,url,descripcion
1,,8000000,8000000,400962,2024-11-05,Casa - Tulancingo de Bravo,482,460,16597.510373443984,17391.304347826088,2023-03-29,13,2024-04-30,Casa,Venta,0,5,5,0,5.0,No,,felipe angeles,tulancingo de bravo,hidalgo,felipe angeles,43640.0,"Felipe Ángeles, Tulancingo de Bravo, Hidalgo",https://www.lamudi.com.mx//detalle/41032-73-60adaf87eb8e-1677-853f180a-b1be-3423,"Casa con amplios espacios en calle privada sobre avenida principal y excelente ubicación, a solo una calle dela antigua Estación del Tren, 480 metros de terreno y 460 metros de construcción con 200 metros de jardín, 5 recamaras incluida la recamara de servicio, 6 baños (4 completos y 2 medios baños) acceso principal con amplio vestíbulo que conecta con la sala de doble altura, el comedor, estudio, cocina y escaleras, la casa esta distribuida sobre 4 desniveles y cuenta con accesos independientes para las áreas de servicio, áreas comunes y áreas privadas. La cocina es muy espaciosa e incluye un cuarto para despensa y desayunador con vista al jardín, la casa cuenta también con sala de TV, salón de fiestas, bodega, espacio para una oficina privada, un tapanco (estudio) que comunica dos recamaras con acceso a la terraza superior, chimenea, cochera eléctrica para dos autos, cuarto de lavado, patio trasero independiente, cisterna y portones eléctricos.Cuenta con excelentes acabados de cantera, madera y hierro.Agenda tu cita, sera un placer atenderte."
2,S1,4810000,4810000,241079,2024-11-05,CASA EN VENTA COL JARDINES DEL SUR TULANCINGO DE BRAVO HIDALGO,228,360,21096.491228070176,13361.111111111111,2023-04-28,12,2024-04-30,Casa,Venta,0,4,0,0,0.0,No,fraccionamiento,jardines del sur,tulancingo de bravo,hidalgo,jardines del sur,43660.0,"Fraccionamiento Jardines del Sur, Tulancingo de Bravo, Hidalgo",https://www.lamudi.com.mx//detalle/41032-73-d5a3d45f5dbe-72d8-ae5720cb-bf37-39c1,"GRAN OPORTUNIDAD!! Adquiere esta propiedad de forma segura, esta propiedad se encuentra ubicada en Calle Franz Von Liszt, Col. Jardines del Sur, Tulancingo de Bravo Hidalgo Está propiedad es de “REMATE BANCARIO”, por lo que, puedes obtenerla por abajo de su valor comercial. “EN ESTE TIPO DE PROPIEDADES NO SE PUEDE APLICAR NINGUN TIPO DE CRÉDITO” ÚNICAMENTE SE ACEPTA PAGO DE CONTADO. 1er. Pago $630,000 la diferencia se paga a la entrega de la Cesión de Derechos, lo cual, se hace ante NOTARIO PÚBLICO. Para su mayor certeza en la operación, de inicio se firma un contrato de servicios que le respalda en el tiempo y la entrega de la propiedad. Agenda tu cita para darte detalles del proceso de adquisición, con gusto te atenderé Araceli Casas Tel. Ver teléfono Whatsapp E-mail Contactar ""SOMOS GRUPO ANTHAM, NOS ESPECIALIZAMOS EN REMATES BANCARIOS, TE ASESORAMOS DESDE EL INICIO Y HASTA LA ENTREGA DE LA PROPIEDAD” REF: ADJ-2193"
3,S1,4500000,4500000,225541,2024-11-05,"Se vende casa en Tulancingo, Fraccionamiento San Francisco Huatengo.",200,287,22500.0,15679.4425087108,2024-01-11,3,2024-04-30,Casa,Venta,0,0,0,0,0.0,No,,residencial la quinta,tulancingo de bravo,hidalgo,san francisco huatengo,43704.0,"Residencial La Quinta, Tulancingo de Bravo, Hidalgo",https://www.lamudi.com.mx//detalle/41032-73-cfbd09274c36-b108-c2a1f4e9-ad07-1237,"Se vende casa en Tulancingo Hidalgo Fraccionamiento San Francisco Huatengo 200 m de terreno Planta Baja:comedor sala Cocina equipada Barra con bancos Cuarto de despensaÁrea de cantina y cantina integrada Amplio jardín con fuente y luz integrada Medio baño Planta alta: Recama principal con clóset vestidor una habitación completa con 2 clóset amplios Baño completo y tina de hidromasaje 2 recámaras junior con clóset y terraza Un baño completo Segunda planta Cuarto de servicio (cabe una habitación matrimonial)Baño completo Cuarto de visitas o área de juegos Roof garden, asador, velaría y cuarto de trebejos200 m de terreno y 287.20 de construcción"
4,S1,4300000,4300000,215517,2024-11-05,"Casa en Venta, Col. La Morena. Tulancingo. Pachuca.",160,240,26875.0,17916.666666666668,2023-09-13,7,2024-04-30,Casa,Venta,1,5,1,0,1.0,No,unidad habitacional,la morena,tulancingo de bravo,hidalgo,rinconada la morena,43625.0,"Unidad Habitacional La Morena, Tulancingo de Bravo, Hidalgo",https://www.lamudi.com.mx//detalle/41032-73-76d564d8c2b1-d515-4c729ba5-b486-46e3,"Bonita casa en venta ubicada en la colonia La Morena.Esta es una excelente ubicación en donde podrás encontrar todo tipo de comercio ( cerca a supermercados, restaurantes, farmacias, etc). Además, tienes escuelas de diferentes niveles en la zona, centros medicos, facilidad para tomar transporte, y rápido acceso a diferentes vías publicas que te conectan con la ciudad.La casa cuenta con 240 m2 de área construida, con sus espacios distribuidos de la siguiente manera:- 3 plantas con espacios amplios y bien iluminados.- 5 recamaras ( 1 recámara en planta baja con baño completo y closet 3 recámaras en 2o. Nivel, la recámara principal cuenta con closet y baño amplios con jacuzzi, 2 recámaras comparten baño. Todas las recámaras tienen piso laminado y closets amplioscolor chocolate. En 3er. Nivel tiene 1 recámara de Servicio con baño completo.)- 4 baños completos / 1 medio baño.- 2 espacios de estacionamiento techado con policarbonato.- Cocina integral ( estufa, campana, horno, alacena, barra)- Cuarto de lavado y tendido.- Jardín o área verde.- Cuenta con calentador solar, calentador de gas y cisterna de 8 mil lts.- Puede venderse amueblada (sala y comedor)Excelente oportunidad de compra.Contactanos y agenda tu visita"
5,,3750000,3750000,187951,2024-11-05,"CASA DE 1 NIVEL EN LA MORENA, TULANCINGO",160,240,23437.5,15625.0,2023-04-21,12,2024-04-30,Casa,Venta,1,4,4,0,4.0,No,unidad habitacional,la morena,tulancingo de bravo,hidalgo,rinconada la morena,43625.0,"Unidad Habitacional La Morena, Tulancingo de Bravo, Hidalgo",https://www.lamudi.com.mx//detalle/41032-73-5b029fa4b8c7-f083-3a6060f6-9bd2-39bf,"CASA EN VENTA COLONIA LA MORENALa Morena es una zona con excelente plusvalía se ubica a solo 5 min. del centro de Tulancingo, central de autobuses y a 3 min. de la central de abastos. Tiene acceso a la carretera Tulancingo-Pachuca.En la zona encontrarás todos los servicios a tu alcance para las necesidades básicas de tu hogar, tiendas locales, tiendas de auto-servicio, panaderías, restaurantes, lavanderías, Oxxo y a 5 min. de bodega Aurrera.La casa cuenta con:Planta baja:  Sala a desnivel.  Comedor.  Cocina equipada.  Cochera para 2 autos con puerta automatizada.  1/2 baño.  Terraza trasera.  Cuarto de servicio grande y completo.  Área de lavado.Planta alta:  4 recámaras con clósets.  Recámara principal con jacuzzi.  4 baños.Pregunta por la forma de pago.PRECIO SUJETO A CAMBIOS Y/O VARIACIONES SIN PREVIO AVISO*El precio publicado corresponde a la propiedad, NO incluye gastos de escrituración u otros conceptos.Horario de atenciónLunes a viernes: 10:00 a 14:00 y 17:00 a 19:00Sábados: 10:00 a 14:00Domingos: previa citaMayores informes y citas: Ver teléfono Whatsapp // WhatsApp // WhatsApp // WhatsApp""HAY UN LUGAR ESPERANDO SER TU HOGAR"""
6,A2,3555000,3555000,178178,2024-11-05,"VENTA DE CASA EN CALLE FRANZ VON LISZT, FRACC. JARDINES DEL SUR, TULANCINGO HIDALGO MÉXICO, ¡NO SE ACEPTAN CRÉDITOS!",228,360,15592.105263157897,9875.0,2024-01-09,3,2024-04-30,Casa En Fraccionamiento,Venta,1,4,1,0,1.0,No,fraccionamiento,jardines del sur,tulancingo de bravo,hidalgo,jardines del sur,43660.0,"Fraccionamiento Jardines del Sur, Tulancingo de Bravo, Hidalgo",https://www.lamudi.com.mx//detalle/41032-73-f965e0ae6b2f-b1c8-8cf5147d-97dd-4d3e,"CASA DE RECUPERACIÓN BANCARIA ADJUDICADO, SE ENTREGA CESION DE DERECHOS EN UN MAXIMO DE 90 DIAS, SE ADQUIERE ÚNICAMENTE CON RECURSOS PROPIOS, NO SE ACEPTAN CRÉDITOS HIPOTECARIOS (BANCARIOS, INFONAVIT, FOVISSSTE)CON EXCELENTE PRECIO Y UBICACIÓN. TENEMOS A LA VENTA.INMUEBLE  Muy cerca de vías principales de acceso, zona de escuelas y parques. Consta: Sala, Comedor Cocina, 4 Recamaras, 3.5 Baños y 1 Lugar de Estacionamiento. Manejamos cartera vencida, proveniente de instituciones financieras, ofrecemos inversiones inmobiliarias con altos rendimientos. Todo garantizado por contrato, con tiempos límite para entrega establecido. Nuestras Cesión de Derechos se efectúan ante Notario Público.Nuestra especialidad es la intermediación entre las instituciones financieras y el cliente final o inversionista, nos encargamos de todo el procedimiento jurídico que conlleva adquirir este tipo de inversiones, hasta la entrega de las mismas, esto significa que hacemos entrega física y material de la propiedad. Nuestro contrato estipula un máximo de tiempo para entrega del inmueble, garantizado.*NOSOTROS NOS HACEMOS CARGO DEL PROCEDIMIENTO HASTA LA ENTREGA DEL INMUEBLE.*COMPRA A UN PRECIO MENOR DEL VALOR COMERCIAL.*NO SE ACEPTA NINGÚN TIPO DE CRÉDITO (INFONAVIT, FOVISSSTE O BANCARIO).*CESIÓN ANTE NOTARIO PÚBLICO.*SE ENTREGA COMPLETAMENTE VACIO.*PLUSVALÍA INMEDIATA.*NUESTRO CONTRATO ESTIPULA UN TIEMPO MÁXIMO PARA LA ENTREGA DE CESION DE DERECHOS.* ASESORÍA DURANTE TODO EL PROCESO HASTA LA ENTREGA DEL INMUEBLE SIN COSTO EXTRA.*NO SE MUESTRA POR DENTRO DEBIDO AL MOMENTO PROCESAL.*PRIMER PAGO SE REALIZA A LA FIRMA DE CONTRATO DE PRESTACIÓN DE SERVICIOS, SEGUNDO PAGO CONTRA ENTREGA DE LA CESIÓN DE DERECHOSLlame y agende una cita en nuestras oficinas para explicarle sin compromiso los detalles y procedimientos de la adquisición de la propiedad."
7,A1,3400000,3400000,170409,2024-11-05,VENTA DE CASA DE LUJO CENTRICA DE TULANCINGO 3 RECAMARAS,200,200,17000.0,17000.0,2024-02-20,2,2024-04-30,Casa,Venta,1,3,1,0,1.0,No,fraccionamiento,santa ana,tulancingo de bravo,hidalgo,santa ana,43642.0,"Fraccionamiento Santa Ana, Tulancingo de Bravo, Hidalgo",https://www.lamudi.com.mx//detalle/41032-73-7b50f7d88d98-1e26-b3b98b79-bf7b-1f12,"VENTA DE CASA POR LA MEGA PRECIO: $3,400,000CERCANIA CON  PLAZA PATIOCENTROS COMERCIALOFFICE DEPOTZONA DE BANCOS SUBURBIAVIPS WALMARTCERCANIA CON LA CARRETERA MÉXICO TUXPANCERCANÍA CON LA UNIVERSIDAD AGROPECUARIA Y TECNOLÓGICA DE TULANCINGO 3 recamarasSalaComedorCocina Jardín EstacionamientoPatio de servicio2 baños y medio Terreno 200 M2Construcción 200 M2Acabados de lujo Visita nuestra página webContactar"
8,A1,3350000,3350000,167903,2024-11-05,VENTA DE CASA AMPLIA Y DE LUJO SEMICENTRICA TULANCINGO 3 RECAMARAS,200,200,16750.0,16750.0,2024-02-20,2,2024-04-30,Casa,Venta,1,4,1,0,1.0,No,fraccionamiento,santa ana,tulancingo de bravo,hidalgo,santa ana,43642.0,"Fraccionamiento Santa Ana, Tulancingo de Bravo, Hidalgo",https://www.lamudi.com.mx//detalle/41032-73-7b50f7d88d98-32e7-bb7921b9-bf7b-1f12,"VENTA DE CASA  DE LUJO SANTA ANNAPRECIO $ 3,350,000Fraccionamiento privado Terreno 200 metros Construcción 265 metros Casa de lujo 4 recamaras, un estudio Sala comedor cocina jardín estacionamiento patio de servicio 3.5 baños y medioCERCANIA AL CENTRO DE TULANCINGOCERCA DE PLAZA PATIOCERCANÍA A ZONA DE BANCOS CERCANIA A WALMART Y MEGA SORIANA CERCANIA A UNIVERSIDAD AGROPECUARIA Y TECNOLÓGICA DE TULANCINGOCERCANIA DE LA CARRETERA MÉXICO TUXPAN VISITA NUESTRA PÁGINA WEBContactarACEPTO CRÉDITOS INFONAVIT FOVISSSTE ISSFAM IMSS CFE BANCARIOS PAGOS DE CONTADOASESORIA INMOBILIARIA Y JURÍDICA GRATIS"
9,B3,3200000,3200000,160385,2024-11-05,VENTA SE CASA ECONOMICA Y DE LUJO EN TULANCINGO HIDALGO 3 RECAMARAS,140,140,22857.14285714286,22857.14285714286,2024-02-20,2,2024-04-30,Casa,Venta,1,3,1,0,1.0,No,,las presas,tulancingo de bravo,hidalgo,reforma la presa,43642.0,"Las Presas, Tulancingo de Bravo, Hidalgo",https://www.lamudi.com.mx//detalle/41032-73-7b50f7d88d98-17e4-5eb74799-bf7b-1f12,VENTA DE CASA DE LUJO EN FRACCIONAMIENTO EXCLUSIVO DE TULANCINGO3 RECAMARASLA PRINCIPAL CON VESTIDOR Y BALCÓN 2 BAÑOS Y MEDIOSALA COMEDORCOCINA CON DESAYUNADORJARDIN ESTACIONAMIENTO PARA 2 AUTOSPATIO DE SERVICIOTANQUE ESTACIONARIO 140 METROS DE TERRENO  160 METROS DE CONSTRUCCIÓNCERCANIA CON LA MEGA TULANCINGOCERCANIA CON EL CENTRO DE TULANCINGOCERCANIA A LA CARRETERA MÉXICO TUXPAN CERCANIA CON LA UNIVERSIDAD TECNOLOGICA DE TULANCINGOY LA UNIVERSIDAD AGROPECUARIA
10,B3,3200000,3200000,160385,2024-11-05,Casa - Tulancingo de Bravo,200,600,16000.0,5333.333333333333,2023-10-25,6,2024-04-30,Casa,Venta,0,3,2,0,2.0,No,,san juan,tulancingo de bravo,hidalgo,san juan,43685.0,"San Juan, Tulancingo de Bravo, Hidalgo",https://www.lamudi.com.mx//detalle/41032-73-ce47f616dd68-627e-e71d1c4a-a33f-3d24,"CASA EN DOS NIVELES.  SE VENDE EN OBRA BLANCA. PLANTA BAJA: ESTANCIA, COMEDOR, COCINA, RECAMARA, MEDIO BAÑO, PATIO DE SERVICIO, ESTACIONAMIENTO. PLANTA ALTA: TRES RECAMARAS, DOS BAÑOS.EL PRECIO ES MAS GASTOS DE ESCRITURACIÓN.HORARIO DE ATENCIÓN DE LUNES A VIERNES DE 9:00 AM A 5:30 PM.   SABADO DE 9.:00AM  A 4:00PM.  DOMINGO DE 10.00 A 2.00PM.EL HORARIO DE ATENCIÓN ES CONSIDERANDO PREVIA CITA.NUM DE CONTACTO PARA AGENDAR.  Ver teléfono Whatsapp NUM DE CONTACTO Y CORREO ELECTRONICO PARA ACLARACIONES Y DUDAS: WhatsApp,  ContactarNUM. DE REGISTRO ANTE PROFECO:   TRAMITEAVISO DE PRIVASIDAD"
11,,3000000,3000000,150361,2024-11-05,"Casa en Privada, Tulancingo de Bravo, Residencial Riva Palacio",200,170,15000.0,17647.058823529413,2023-12-15,4,2024-04-30,Casa,Venta,0,2,3,0,3.0,No,,la escondida,tulancingo de bravo,hidalgo,la escondida,43640.0,"La Escondida, Tulancingo de Bravo, Hidalgo",https://www.lamudi.com.mx//detalle/41032-73-50049742f4f-c74f-e43909c1-bfe6-4285,"Casa Residencial en Privada Riva Palacio, en Col. La Escondida. La colonia ""La Escondida"", se encuentra en la zona centro de la Ciudad de Tulancingo Hidalgo, a escasos 5 minutos del primer cuadro de la ciudad, ubicada en una zona tranquila y segura.La colonia cuenta con escuelas públicas y privadas, muy cerca del Colegio Pedro de Gante, cerca del parque infantil “el Caracol”, iglesia, a 8 minutos del centro Comercial “Plaza Patio Tulancingo”, donde podrá encontrar el supermercado, cine, office depot, Coppel, peter pizza, Sams, Vips, etc….La casa 1 nivel cuenta con: Sala.Comedor.Cocina.1 medio baño. 2 recámaras grandes con vestidor.2 baños completos.Garaje para 1 auto.Cuarto de lavado. Amenidades:Tanque estacionario. Cisterna de 10,000 litros. Zaguán automático. Pregunta por la forma de pago.PRECIO SUJETO A CAMBIOS Y/O VARIACIONES SIN PREVIO AVISO*El precio publicado corresponde a la propiedad, NO incluye gastos de escrituración u otros conceptos. Horario de atenciónLunes a viernes: 10:00 a 14:00 y 17:00 a 19:00Sábados: 10:00 a 14:00Domingos: previa citaMayores informes y citas: Ver teléfono Whatsapp // WhatsApp // WhatsApp // WhatsApp""HAY UN LUGAR ESPERANDO SER TU HOGAR"""
12,B2,2900000,2900000,145349,2024-11-05,"Casa de 3 recámaras en Privada Riva Palacio, La Morena Tulancingo Hgo",120,150,24166.666666666668,19333.33333333333,2023-10-31,6,2024-04-30,Casa,Venta,1,3,1,0,1.0,No,unidad habitacional,la morena,tulancingo de bravo,hidalgo,rinconada la morena,43625.0,"Unidad Habitacional La Morena, Tulancingo de Bravo, Hidalgo",https://www.lamudi.com.mx//detalle/41032-73-bfb49856282a-e531-99e14565-8dd0-47ce,"Privada ""Riva Palacio"" pertenece a Col. La Morena, zona con excelente plusvalía se ubica a solo 5 min. del centro de Tulancingo, central de autobuses y a 3 min. de la central de abastos. Tiene acceso a la carretera Tulancingo-Pachuca. En la zona encontrarás todos los servicios a tu alcance para las necesidades básicas de tu hogar, tiendas locales, tiendas de auto-servicio, panaderías, restaurantes, lavanderías, Oxxo y a 5 min. de bodega Aurrera.La casa de 2 niveles cuenta con:Sala.Comedor.Cocina integral equipada.Alacena.1 medio baño.1 recámara principal con vestidor, terraza y 1 baño completo.2 recámaras con clóset.1 baño compartido.Patio de servicio.Estacionamiento para 2 autos.Cisterna.Calentador solar.Tanque estacionario.Pregunta por la forma de pago.PRECIO SUJETO A CAMBIOS Y/O VARIACIONES SIN PREVIO AVISO*El precio publicado corresponde a la propiedad, NO incluye gastos de escrituración u otros conceptos. Horario de atenciónLunes a viernes: 10:00 a 14:00 y 17:00 a 19:00Sábados: 10:00 a 14:00Domingos: previa cita""HAY UN LUGAR ESPERANDO SER TU HOGAR"""
13,B2,2900000,2900000,145349,2024-11-05,"Una casa perfectamente diseñada en la mejor ubicación de Tulancingo, La Morena",120,154,24166.666666666668,18831.16883116883,2023-11-16,5,2024-04-30,Casa,Venta,1,3,1,0,1.0,No,,conjunto habitacional los mesones,tulancingo de bravo,hidalgo,privada los mesones,43624.0,"Conjunto Habitacional Los Mesones, Tulancingo de Bravo, Hidalgo",https://www.lamudi.com.mx//detalle/41032-73-f1d9f7d3a1ab-c9e6-ef7f900e-b973-4d71,"¡Bienvenido al hogar de tus sueños en la prestigiosa zona de La Morena! Esta casa única de dos niveles se encuentra una ubicación privilegiada que ofrece comodidades excepcionales y en Privada acceso automatizado para tu tranquilidad. Imagina vivir en una de las áreas de mayor plusvalía de la Ciudad, rodeado de todo lo que necesitas. Esta casa está estratégicamente ubicada cerca de escuelas, hospitales, restaurantes, zonas comerciales y el encantador Centro Histórico de la Ciudad, ""La Floresta"". Además, su proximidad a vías rápidas y la salida hacia destinos clave como CDMX, Pachuca, Huasca y Tuxpan facilitan tu movilidad. La distribución cuidadosamente planificada de esta casa garantiza un estilo de vida cómodo y funcional. En la planta baja, te recibirá un garaje cerrado para dos autos, seguido de un vestíbulo que da paso a una sala luminosa y un comedor. El baño de visitas añade un toque de conveniencia, mientras que la cocina, equipada con una amplia alacena, te invita a deleitar tus sentidos. Disfruta del aire fresco en el patio de servicio y el hermoso jardín que complementa la casa. Sube al segundo nivel, donde un vestíbulo te guía hacia dos recámaras secundarias, compartiendo un baño completo. La recámara principal, un verdadero refugio privado, cuenta con terraza, un vestidor y baño completo para tu comodidad y privacidad. Esta casa viene equipada con todo lo que necesitas para vivir de manera práctica y lujosa. Disfruta de la tranquilidad que brinda la cisterna, la funcionalidad de la cocina integral, la conveniencia de una amplia alacena y el confort del calentador de paso para tres servicios. Los clósets en todas las recámaras ofrecen un amplio espacio de almacenamiento, mientras que el doble lavabo en la recámara principal agrega un toque de elegancia. Los canceles en los baños de la planta alta, el tinaco y el tanque estacionario son solo algunas de las características que hacen de esta casa un hogar completo. No dejes pasar la oportunidad de ser dueño de esta residencia única en su clase. ¡Contáctanos ahora para programar una visita y descubrir cómo esta casa puede convertirse en tu refugio perfecto en Tulancingo! Vive la vida que mereces en ""La Morena""."
14,B2,2890000,2890000,144848,2024-11-05,CASA EN VENTA EN TULANCINGO A 45 MINUTOS DE LA CIUDAD DE MEXICO,220,140,13136.363636363636,20642.85714285714,2023-05-05,11,2024-04-30,Casa,Venta,1,3,3,0,3.0,No,,conjunto habitacional los mesones,tulancingo de bravo,hidalgo,privada los mesones,43624.0,"Conjunto Habitacional Los Mesones, Tulancingo de Bravo, Hidalgo",https://www.lamudi.com.mx//detalle/41032-73-9e6409a03fe5-da06-4354ce5b-bbea-3254,"Cochera sala comedor cocina 2 baños y medio terraza jardin 3 Recamaras vestidor en recamara principal estudio Sector privado opcion de chimenea , bar o cocina integralAmplio jardin. EasyBroker ID: EB-CD0497"
15,B2,2758000,2758000,138232,2024-11-05,VVV VENTA DE CASA CALLE FRANZ VON LISZT JARDINES DEL SUR 3A SECC TULANCINGO DE BRAVO HIDALGO,70,140,39400.0,19700.0,2024-02-28,2,2024-04-30,Casa,Venta,1,3,1,0,1.0,No,fraccionamiento,jardines del sur,tulancingo de bravo,hidalgo,jardines del sur,43660.0,"Fraccionamiento Jardines del Sur, Tulancingo de Bravo, Hidalgo",https://www.lamudi.com.mx//detalle/41032-73-4c88e4b1cb97-8a55-3dcaa553-ad27-426f,"Gran oportunidad para invertir a precio por debajo de su valor comercial.adquiere este inmueble de recuperación, cartera vencida de créditos hipotecarios a través de cesión de derechos ante notario público.somos una empresa con experiencia en recuperaciones de cartera vencida.*pago solo con recursos propios, no se aceptan créditos.*no son de entrega inmediata.*inversión garantizada bajo contrato.*disponibilidad y precios sujetos a cambio sin previo aviso**características aproximadas, imágenes ilustrativas*contáctame para mayor información y agenda una cita:Vanessa Valencia Ver teléfono Whatsapp.ID: VVV // AZ92153"
16,B2,2758000,2758000,138232,2024-11-05,"Casa VENTA, Jardines del Sur, Tulancingo de Bravo",160,160,17237.5,17237.5,2024-02-29,2,2024-04-30,Casa,Venta,1,3,1,0,1.0,No,fraccionamiento,jardines del sur,tulancingo de bravo,hidalgo,jardines del sur,43660.0,"Fraccionamiento Jardines del Sur, Tulancingo de Bravo, Hidalgo",https://www.lamudi.com.mx//detalle/41032-73-467b23fd01cb-cb12-3a22ec63-8c62-4978,"Casa VENTA, Jardines del Sur, Tulancingo de BravoEHL ID AZ92153Propiedad en CESIÓN DE DERECHOS en Jardines del Sur, Tulancingo de Bravo• Solamente contado / NO CRÉDITOS• Entrega de 10 a 14 meses.• La vivienda sólo se puede ver por fuera.¿Te interesa?Llámanos al Ver teléfono Whatsapp o escríbenos al correo: ContactarPRECIOS Y DISPONIBILIDAD SUJETOS A CAMBIOS SIN PREVIO AVISO. *LOS DETALLES DEL INMUEBLE SON APROXIMADOS.Condición construcción: BuenaUso de suelo: HabitacionalMétodo de pago: CONTADOClave interna: EHL ID AZ92153"
17,B1,2700000,2700000,135325,2024-11-05,Amplia casa en venta Tulancingo Hgo.,232,200,11637.93103448276,13500.0,2023-10-20,6,2024-04-30,Casa,Venta,1,3,3,0,3.0,No,fraccionamiento,el mirador,tulancingo de bravo,hidalgo,el mirador,43659.0,"Fraccionamiento El Mirador, Tulancingo de Bravo, Hidalgo",https://www.lamudi.com.mx//detalle/41032-73-7beec3489eb2-2e79-af1c855a-9632-4633,"🏵️ Vendo amplia casa en esquina de 2 niveles. 😃 El hogar ideal para una familia de 6 o más integrantes (más mascotas) fácil acceso, a 4 min. Al centro de la ciudad. 232 m. De terreno. 200.93 m. De construcción. Contiene:- 3 recamaras con closet cada una y baño en la principal- Baño para recamaras secundarias. - Sala - Comedor - Cocina - Zotano- Estacionamiento 2 autos. - Doble zaguán electrico. - Oficina - Cisterna - Bardas perimetrales con cerco electrificado. - Patio trasero para recreación o eventos. Precio $2,700,000.00 (más gastos de escrituracion)  Precio a tratar. ➖➖➖➖➖Más información con:👨🏽‍💼 Germán Romero Profesional Inmobiliario 📱 Ver teléfono Whatsapp"
18,B1,2650000,2650000,132819,2024-11-05,"CASA NUEVA EN VENTA RESIDENCIAL TERRANOVA, TULANCINGO.",202,135,13118.81188118812,19629.62962962963,2023-04-20,12,2024-04-30,Casa En Fraccionamiento,Venta,1,3,2,0,2.0,No,,la canada,tulancingo de bravo,hidalgo,la canada,43615.0,"La Cañada, Tulancingo de Bravo, Hidalgo",https://www.lamudi.com.mx//detalle/41032-73-48844530cc85-8bf0-ff3c1c48-b7eb-39b9,"CASA EN VENTA TERRANOVA. Residencial Terranova es una zona con excelente plusvalía, gracias a su ubicación tiene cerca bancos, escuelas, central de autobuses, hospitales, avenidas importantes de Tulancingo y esta cerca de la Plaza del Vestido. La casa cuenta con:  3 recámaras. Recámara principal con baño. Sala-comedor. Cocina integral con barra desayunador. Jardín interior. Cuarto de lavado. Garaje 2 autos. Cisterna de 8,500 lts. Roof garden iluminado con asador.   PRECIO SUJETO A CAMBIOS Y/O VARIACIONES SIN PREVIO AVISO *El precio publicado corresponde a la propiedad, NO incluye gastos de escrituración u otros conceptos. *Todas las imágenes mostradas son solo para fines ilustrativos y  pueden NO ser la representación exacta del inmueble.  Horario de atención Lunes a viernes: 10:00 a 14:00 y 17:00 a 19:00 Sábados: 10:00 a 14:00 Domingos: previa cita Mayores informes y citas: Ver teléfono Whatsapp // WhatsApp // WhatsApp // WhatsApp ""HAY UN LUGAR ESPERANDO SER TU HOGAR"""
